{
  "$schema": "https://json-schema.org/draft/2020-12/schema",
  "$id": "budynek-sumy-strat.v1.schema.json",
  "title": "budynek-sumy-strat, wersja schematu 1 (migawka wyników)",
  "description": "Migawka sum strat budynku z aplikacji konstrukcyjnej (eksporter: inzynier-szkieletowy-pro) do aplikacji instalacyjnej (importer: inzynier-offgrid-pro). Koperta wg 18.16, wyjątek 'migawka wyników' wg 18.15. STATUS: wersja robocza 🔎 — definicje wartości w 'dane' do potwierdzenia przez eksportera przed pierwszym eksportem (patrz README.md tego folderu).",
  "type": "object",
  "additionalProperties": false,
  "required": ["schemat", "wersjaSchematu", "rodzajDanych", "zrodlo", "wyeksportowano", "projekt", "statusWyniku", "sumaKontrolna", "dane"],
  "properties": {
    "schemat": { "const": "budynek-sumy-strat" },
    "wersjaSchematu": { "const": 1 },
    "rodzajDanych": {
      "const": "migawka-wynikow",
      "description": "Wyjątek od 'tylko Seed' (18.15). Importer pokazuje 'stan na <wyeksportowano>' i oznacza wartości jako 'cudze, nieliczone tu'."
    },
    "zrodlo": {
      "type": "object",
      "additionalProperties": false,
      "required": ["aplikacja", "wersjaAplikacji"],
      "properties": {
        "aplikacja": { "type": "string", "minLength": 1 },
        "wersjaAplikacji": { "type": "string", "minLength": 1, "description": "Numer wersji programu wg 3.8 (pierwsza cyfra = zmiana zasad liczenia)." },
        "identyfikatorBuilda": { "type": "string", "minLength": 1, "description": "Opcjonalnie: identyfikator builda (3.8 pkt 3)." }
      }
    },
    "wyeksportowano": { "type": "string", "format": "date-time", "description": "ISO 8601 ze strefą czasową." },
    "projekt": {
      "type": "object",
      "additionalProperties": false,
      "required": ["id", "nazwa"],
      "properties": {
        "id": { "type": "string", "minLength": 1 },
        "nazwa": { "type": "string", "minLength": 1, "description": "Nazwa wpisana przez użytkownika. Plik nie niesie innych danych osobowych (18.16 pkt 5)." }
      }
    },
    "wersjaPaczkiSrodowiskowej": {
      "type": ["string", "null"],
      "description": "Opcjonalnie: wersja paczki dane-srodowiskowe, z której liczono (19.4, 19.13). Sumy strat budynku mogą od niej nie zależeć — wtedy null albo brak pola."
    },
    "statusWyniku": {
      "enum": ["VALID", "VALID_WITH_WARNINGS", "ESTIMATE"],
      "description": "Najsłabszy status spośród wartości w 'dane' (3.3, 3.7 pkt 2). Importer dziedziczy najsłabszy status: ESTIMATE nie jest w importerze prezentowany jako VALID. Przy INCOMPLETE, OUT_OF_SCOPE i INVALID_INPUT eksporter nie tworzy pliku (brak liczb do przekazania)."
    },
    "statusyPol": {
      "type": "object",
      "description": "Opcjonalnie: status każdej wartości z 'dane' (klucze jak w 'dane'). Pozwala importerowi pokazać, które liczby są szacunkiem, a nie całą migawkę.",
      "additionalProperties": false,
      "properties": {
        "przenikanieZMostkamiWK": { "enum": ["VALID", "VALID_WITH_WARNINGS", "ESTIMATE"] },
        "wentylacjaWK": { "enum": ["VALID", "VALID_WITH_WARNINGS", "ESTIMATE"] },
        "powierzchniaM2": { "enum": ["VALID", "VALID_WITH_WARNINGS", "ESTIMATE"] },
        "kubaturaM3": { "enum": ["VALID", "VALID_WITH_WARNINGS", "ESTIMATE"] }
      }
    },
    "ostrzezeniaKody": {
      "type": "array",
      "description": "Opcjonalnie: kody ostrzeżeń ze źródła (04.1: tylko kody, nigdy gotowy tekst; tłumaczy importer wg 17.2).",
      "items": { "type": "string", "minLength": 1 }
    },
    "sumaKontrolna": {
      "type": "string",
      "pattern": "^[0-9a-f]{64}$",
      "description": "SHA-256 (małe litery hex) z kanonicznego JSON pola 'dane' (RFC 8785). Wykrywa przypadkowe uszkodzenie, nie manipulację — nie jest podpisem."
    },
    "dane": {
      "type": "object",
      "additionalProperties": false,
      "required": ["przenikanieZMostkamiWK", "wentylacjaWK", "powierzchniaM2", "kubaturaM3"],
      "properties": {
        "przenikanieZMostkamiWK": {
          "type": "number", "minimum": 0,
          "description": "Suma strat przez przenikanie z uwzględnieniem mostków cieplnych, W/K. 🔎 Dokładna definicja (metoda, temperatury odniesienia) do potwierdzenia przez eksportera."
        },
        "wentylacjaWK": {
          "type": "number", "minimum": 0,
          "description": "Straty wentylacyjne, W/K. 🔎 Założenia (krotność wymian, wentylacja grawitacyjna/mechaniczna) do potwierdzenia przez eksportera."
        },
        "powierzchniaM2": {
          "type": "number", "exclusiveMinimum": 0,
          "description": "Powierzchnia budynku, m². 🔎 Które pole (ogrzewana użytkowa, całkowita) — do potwierdzenia przez eksportera."
        },
        "kubaturaM3": {
          "type": "number", "exclusiveMinimum": 0,
          "description": "Kubatura, m³. 🔎 Brutto czy ogrzewana — do potwierdzenia przez eksportera."
        }
      }
    }
  }
}
