{
  "schemat": "budynek-sumy-strat",
  "wersjaSchematu": 1,
  "rodzajDanych": "migawka-wynikow",
  "zrodlo": { "aplikacja": "inzynier-szkieletowy-pro", "wersjaAplikacji": "0.0.0-przyklad" },
  "wyeksportowano": "2026-10-18T12:00:00+02:00",
  "projekt": { "id": "przyklad-0001", "nazwa": "Przykładowy dom (dane fikcyjne, tylko do testu kontraktowego)" },
  "wersjaPaczkiSrodowiskowej": null,
  "statusWyniku": "ESTIMATE",
  "statusyPol": {
    "przenikanieZMostkamiWK": "ESTIMATE",
    "wentylacjaWK": "VALID",
    "powierzchniaM2": "VALID",
    "kubaturaM3": "VALID"
  },
  "ostrzezeniaKody": ["THERMAL_BRIDGE_ESTIMATE"],
  "sumaKontrolna": "c1185f139a65d91d12d81d3ccff88002209d3221d9c2a269ac32ccab628b6bdd",
  "dane": {
    "przenikanieZMostkamiWK": 112.5,
    "wentylacjaWK": 48.2,
    "powierzchniaM2": 132,
    "kubaturaM3": 330
  }
}
